{
  "mode": "focus",
  "currentTask": "Finish Cluck In prototype",
  "focusStartedAt": "2026-09-19T11:30:00+08:00",
  "focusRemainingSeconds": 1320,
  "heldMessages": 12,
  "urgentMessages": 2,
  "upcomingEvents": 1,
  "chicken": {
    "mood": "focused",
    "energy": 80
  },
  "lastUpdatedAt": "2026-09-19T11:33:00+08:00"
}
